{
  "templateId": "SectionCard",
  "description": "Standard container card with title, description, optional action, and child components.",
  "parameters": {
    "title": {
      "type": "string",
      "title": "Section Title",
      "description": "Heading text displayed at the top of the section card."
    },
    "description": {
      "type": "string",
      "title": "Section Description",
      "description": "Subordinate descriptive text beneath the title.",
      "default": ""
    },
    "headerAction": {
      "type": "action",
      "title": "Header Action Callback",
      "description": "Event action or child component triggered from the header."
    },
    "children": {
      "type": "children",
      "title": "Section Children",
      "description": "Child component IDs rendered in the section body.",
      "default": []
    }
  },
  "components": [
    {
      "id": "root",
      "component": "Card",
      "child": "main_col"
    },
    {
      "id": "main_col",
      "component": "Column",
      "children": ["header_row", "desc_txt", "divider", "body_container"]
    },
    {
      "id": "header_row",
      "component": "Row",
      "justify": "spaceBetween",
      "align": "center",
      "children": ["title_txt", "action_slot"]
    },
    {
      "id": "title_txt",
      "component": "Text",
      "text": {"param": "title"},
      "variant": "h3"
    },
    {
      "id": "action_slot",
      "component": "Column",
      "children": {"param": "headerAction"}
    },
    {
      "id": "desc_txt",
      "component": "Text",
      "text": {"param": "description"},
      "variant": "caption"
    },
    {
      "id": "divider",
      "component": "Divider",
      "axis": "horizontal"
    },
    {
      "id": "body_container",
      "component": "Column",
      "children": {"param": "children"}
    }
  ],
  "sampleData": {
    "title": "Protocol Overview",
    "description": "High-level summary of the streaming architecture.",
    "children": []
  }
}
